{"baseRef":"main","baseSha":"aaaaaaaaaaaaaaaaaaaaaaaaaaaaaaaaaaaaaaaa","calibratedConcurrencyCeiling":2,"dispatchStrategy":"rolling","effortPolicyVersion":"speed.v1","exactModel":"gpt-5.6-sol","executionMode":"parallel","experimentalRollingAuthorized":true,"hostConcurrencyCeiling":2,"integrationBranch":"cb/rolling/integration","integrationExpectedSha":"aaaaaaaaaaaaaaaaaaaaaaaaaaaaaaaaaaaaaaaa","runId":"cb-rolling-1111111111111111","schemaVersion":"compass-builder.run-spec.v2","stories":[{"acceptanceChecks":["alpha contract is green"],"ambiguity":"low","completionState":"pending","complexity":"medium","dependsOn":[],"description":"Create the first closed rolling contract.","id":"alpha","independentReviewPath":null,"priority":10,"requiredOutcomeGateIds":["gate-alpha"],"risk":"medium","sharedState":{"description":"No shared mutable state.","mode":"none"},"title":"Alpha contract","validationCommands":["python -m unittest tests.test_builder_rolling_models"],"validationStrength":"decisive","writeScopes":["src/alpha"]},{"acceptanceChecks":["beta binding is green"],"ambiguity":"low","completionState":"pending","complexity":"medium","dependsOn":["alpha"],"description":"Bind a dependent rolling contract.","id":"beta","independentReviewPath":null,"priority":5,"requiredOutcomeGateIds":["gate-beta"],"risk":"medium","sharedState":{"description":"Reads alpha output without mutation.","mode":"read-only"},"title":"Beta contract","validationCommands":["python -m unittest tests.test_builder_rolling_models"],"validationStrength":"decisive","writeScopes":["src/beta"]}],"userConcurrencyCeiling":2,"validationCommands":["python -m unittest tests.test_builder_rolling_models tests.test_builder_models"]}
